{"$schema":"https://json-schema.org/draft/2020-12/schema","$id":"https://ndoracle.org/schema/types/concept-v0.2.json","title":"ND Oracle concept object v0.2","type":"object","additionalProperties":false,"required":["schema_version","id","type","status","provenance","name","aliases","summary","scope","claims","relations","question_ids"],"properties":{"schema_version":{"const":"0.2"},"id":{"$ref":"https://ndoracle.org/schema/common-v0.2.json#/$defs/identifier"},"type":{"const":"concept"},"status":{"$ref":"https://ndoracle.org/schema/common-v0.2.json#/$defs/status"},"provenance":{"$ref":"https://ndoracle.org/schema/common-v0.2.json#/$defs/provenance"},"name":{"$ref":"https://ndoracle.org/schema/common-v0.2.json#/$defs/nonBlankString"},"aliases":{"type":"array","items":{"$ref":"https://ndoracle.org/schema/common-v0.2.json#/$defs/nonBlankString"},"uniqueItems":true},"summary":{"type":"string","minLength":20,"pattern":"\\S"},"scope":{"type":"object","additionalProperties":false,"required":["includes","excludes"],"properties":{"includes":{"type":"array","minItems":1,"items":{"$ref":"https://ndoracle.org/schema/common-v0.2.json#/$defs/nonBlankString"}},"excludes":{"type":"array","minItems":1,"items":{"$ref":"https://ndoracle.org/schema/common-v0.2.json#/$defs/nonBlankString"}}}},"claims":{"type":"array","minItems":1,"items":{"$ref":"https://ndoracle.org/schema/common-v0.2.json#/$defs/claim"}},"relations":{"type":"array","items":{"$ref":"https://ndoracle.org/schema/common-v0.2.json#/$defs/relation"}},"question_ids":{"type":"array","items":{"$ref":"https://ndoracle.org/schema/common-v0.2.json#/$defs/identifier"},"uniqueItems":true}}}