{"schema_version":"0.2","id":"fixture-broader-concept","type":"concept","name":"Fixture broader concept","aliases":[],"status":"draft","summary":"A second synthetic concept used only to prove reciprocal structural relations.","scope":{"includes":["synthetic relation validation"],"excludes":["authoritative neurodiversity knowledge"]},"claims":[{"id":"fixture-broader-claim","text":"The broader synthetic fixture exists to exercise relation validation.","confidence":"moderate","evidence_ids":["fixture-evidence"],"uncertainties":[{"id":"fixture-broader-uncertainty","statement":"The proposition is deliberately synthetic.","why_it_matters":"This limitation constrains interpretation.","reopening_or_reduction_condition":"Additional synthetic evidence would reduce it."}],"question_ids":[]}],"relations":[{"type":"broader_than","target":{"type":"concept","id":"fixture-concept"},"reason":"Synthetic inverse-relation test.","confidence":"not_applicable","evidence_ids":[],"uncertainties":[],"question_ids":[]}],"question_ids":[],"provenance":{"created":"2026-08-11","created_by":"test fixture","method":"Synthetic test-only fixture","review_state":"unreviewed_seed","last_reviewed":null}}